"Company","Year","Text"
"Competitors",2020,"This is more than just a cookie. It is a guilty pleasure. Except that you dont have to feel guilty because it is good for you. It is so soft and fresh you would think your grandma just baked it. LOVE LOVE LOVE it!"
"Competitors",2021,"I received a sample pack of the Raisin variety of  Soft Baked Oatmeal Cookies from Influenster to test out with my family.My 22 month old son loved the cookie and almost ate the whole thing himself. I did manage a couple bites and I love the soft, chewy-ness of the cookie. Plus, it provides a good source of fiber, something we don't incorporate enough of in our diets sometimes. I will definitely consider purchasing more of these cookies as a snack for my son!"
"Competitors",2022,"The soft baked cookies are amazingly delicious! Even my children really enjoy them!! I was surprised when they all actually ate it because they never eat anything with raisins in it. This was exciting since I now keeps these with me in case the boys need a snack since they would be able to eat one between the four of them."
"Competitors",2020,"My kids will devour these cookies. They must be super good because believe it or not my kids are picky cookie eaters. I do not like raisins personally so I haven't tried them myself. My only negative thing I can think of is that they are very crumby because they are soft, so with kids it gets quite messy."
"Competitors",2020,", which knows a thing or two about oats, has put together a pretty nice oatmeal cookie here. The cookie is soft, as advertised, but is NOT pillowy, doughy, gooey or some other displeasing variety of soft. Rather, it just has a nice yielding softness. No doubt related to the consistency, the cookie is not cloyingly sweet. Oh, it's still definitely a cookie - but you're not overwhelmed with a sugar rush. The raisins didn't add a lot of flavor - the ones I encountered weren't large or anything remotely like plump.Overall, this seems like a relatively low-guilt addition to a lunchbox or a desk drawer for snack time. Tasty, soft, and full of oatmealy goodness."
"Competitors",2021,"After trying these cookies for the first time, i am hooked and dont feel guilty because they are delicious. Thanks  for another awesome product."
"Competitors",2022,"In one box you get six cookies, each individually wrapped.  Which is all meant to be quite convenient, I suppose.  Throw one in your child's lunchbox and send him/her off.  Frankly, these cookies are not nearly as delicious as the ones my husband and I make and ours are lower in fat and calories, with fewer additives.  In other words, healthier.But ""healthier"" isn't why most people buy pre-made food products and these cookies taste good enough.  I love oatmeal raisin cookies and I wasn't disappointed by these enough to dislike them.  However, <a href=""http://www.amazon.com/gp/product/B004L5UD2K"">Grandma's Homestyle Oatmeal Raisin Big Cookie, 2.5 Oz Bag (Pack of 20)</a> are lower in calories and have the same amount of fat, per cookie.  (Of course, it's hard to eat just the one when there are two in the package so you'd have to share.)I know that it's hard to find time to bake from scratch sometimes but the effort to do so, teaching a child how to measure and mix a recipe from scratch, to then enjoy something that the two (or three or four) of you made together, is invaluable.  Make a double batch and freeze the dough before baking and you wouldn't have to do this every week to have enough cookies to last entire month or longer.  You'll build bonding moments, create less waste, teach simple mathematics and cooking skills, and provide a far healthier snack option for your child(ren).And if you truly don't have the time to bake cookies, then buy some fresh fruit.  If nothing else, you'll have fewer additives and most fruit comes in it's own convenient packaging."
"Competitors",2020,"Love these cookies my Son asks me to heat one for him in the microwave for about 15 sec its soooo good that way gives it the freshly baked feel...I always make sure to keep in stock in my home...they are also individually packed do makes it easy to carry along in my bag"
"Competitors",2020,"These cookies are so soft and tasty. I love the texture of the cookie!! I will definitely be eating these cookies as a snack for lunch."
"Competitors",2020," Soft Baked Oatmeal Cookies (raisin) fail the most important test of a cookie.  They are not delicious.  Considering they're 170 calories for ONE cookie you'd expect something decadent.  It's not even as tasty as an average cookie.A little bit dry considering it's supposed to be soft, moist cookie.  A slight sandy or grainy texture.  There's nothing foul or obnoxious about the taste - it's just nothing special.Nutritionally - ok for a cookie.  170 calories, 1.5g sat fat.  4g fiber!  (quite a bit.)  But I don't look at a cookie as some sort of health food.  A big* cookie like this should be an indulgence - a treat.  Instead it's not abhorrent.  If you start eating this, you'll finish it.  But you won't go out of your way for another one.*not THAT big.  It's not like a famous amos or something."
"Competitors",2022,"TOTALLY DIFFERENT!chewy, soft-baked cookie, Healthier alternative,Individually packaged / Good for on the go!The Verdict:Great Healthier snack for all the family!I don't like oatmeal & raisins... but this cookie really taste great! :D"
"Competitors",2020,"It is nice to have a cookie that my kids enjoy and I don't have to worry about it being unhealthy. I was very happy to receive this in my Influenster Mom Voxbox!"
"Competitors",2020,"totally my kids favorite cookie so good soft not so much sweet exactly one that i want to give my kid"
"Competitors",2022," Soft Baked Oatmeal Cookies are now my favorite cookies.  They are so soft and delicious.  And I love how they come individually wrapped so I don't have to worry about the rest of them going stale.I definitely recommend giving these cookies a try - you'll be glad you did!"
"Competitors",2021,"I got a sample of these from Influenster, and I went out and bought more right away.  These are the softest and tastiest packaged cookies I've had.  I love the flavor, Oatmeal Raisin cookies are my favorite.  Even though they are cookies, I feel like I could be doing a lot worse health-wise than these."
"Competitors",2021,"I received a sample package of this product complimentary from [...]  to try. I must say, it was super yummy. The cookies are large enough to satisfy my sweet tooth yet small enough that i didn't feel like I was gorging myself either. Best part is, they are healthy enough that i don't mind feeding them to my kiddos as a special treat."
"Competitors",2021,"Love the soft baked cookies, tastes great and I don't feel guilty eating this cookie. They are also individually wrapped so it's great for throwing in a bag for hiking or in kid's lunch. I tried the oatmeal raisin and must say it's my favorite, apparently many others favorites as I can never found them on the shelves."
"Competitors",2020,"I got the  box and it had several products in it.  My kids loved the  soft bake cookie.  would get some if I were you"
"Competitors",2022,"Cookie was so soft and my son acutally loved it and he really doesnt like a lot of item. I really love this cookie and i did purchase again."
"Competitors",2021,"my kids and i enjoyed the  Soft Baked cookies.  they are great for lunch boxes and for snacks at home or on the go.  i loved the soft baked texture and fresh taste."
"Competitors",2020,"This is a great tasting cookie.  Portion size is close to perfect.  Soft texture with almost homemade flavor.  What a find?!?! I love these cookies!"
"Competitors",2021," always surprises me with all their wonderful products which are satisfying for the whole family. I really love these Oatmeal soft baked cookies!! They are made from whole grain  oats and have a wonderful flavor! I can't wait to buy more of these and other yummy products!"
"Competitors",2022,"I really enjoyed these cookies. They tasted fresh & homemade and very soft and chewy.....I will purchase again, definitely a favorite!"
"Competitors",2020,"I just love the oatmeal raisein cookie it was super soft and delicious, i was amazed by the amount of raisens in it because there usually isnt enough in other brands. Not only did i love this cookie but my daughter loved it so much i had to go out and buy a box of them. Id def. reccomend these to any cookie lover, im a fan for life."
"Competitors",2020,"These are so yummy. They taste just like my grandmas homestyle cookies. They are a perfect texture, just enough sweetness, and leave you craving for more! I can't get enough of them. I eat them with a nice glass of cold milk and it's heaven!"
"Competitors",2021,"These are really good.  I love raisin cookies and this one did not dissapoint me.  It is soft and they are in individual packs.  I got it free from Influenster to try and liked it."
"Competitors",2020,"These cookies would be better if they were made with rolled oats instead of oat flour. The crumbly and mealy texture does not provide an enjoyable experience."
"Competitors",2021,"This cookie is full of flavor and at a great price.  I got a sample free in the mail, and will be buying more for my son!  We both loved them."
"Competitors",2022,"This cookie was moist chewy and delicious.  Both my daughter and I thought it was fabulous and I will definitely buy in the future."
"Competitors",2021,"This is pretty good for a store bought cookie! It was nice and soft, not too sweet. Just right. I gave them 4 instead of 5 stars because I like my cookies a little chewy. Overall great cookie! I got one of these cookies as a sample from @."
"Competitors",2022,"This cookie was really good... I liked the single serve packaging and the portability of the product! great for on the go and not loaded with junk!"
"Competitors",2021,"I am very impressed with the  Soft Baked Oatmeal Cookies. They are a healthier cookie and have a great taste. Very soft and melt in your mouth."
"Competitors",2021,"It's not too sweet so I like that. The kids love it and let's face it, cookies are generally not healthy, so this is ok, not the healthiest, but good!"
"Competitors",2020,"These cookies are delicious, a little messy but have a great taste, my kids also enjoyed them, it is a lunch bag must have."
"Competitors",2022,"I'm not a lover of oatmeal raisin cookies, but this one surprised me! I loved how soft and flavorful it was. YUM. I highly recommend. I got these as a sample from Influensters!"
"Competitors",2021,"I love these. They taste great and they are easy to throw in your bag and bring a long with you for a snack for yourself or a child. My 3 year old liked the taste as well. I do think they are a bit pricey but they are full of whole grains which is better than normal cookies."
"Competitors",2022,"My son and I both LOVED these cookies, very yummy and delicious.  My son ate them so quickly that I hardly got any LOL.  I really like the texture of the cookies, and they are quite filling."
"Competitors",2020,"I received a  Soft Baked Oatmeal cookie in my Mom Voxbox from Influenster, and it was a big hit.  Soft, chewy, and tasty.  Only thing I would change about it is that it doesn't travel very well because it gets too crumbly."
"Competitors",2021,"The  Oatmeal Raisin cookies could not be more delicious! They have that homemade taste w/out all the mess!! I was surprised at how soft they were and you could really taste cinnamon and other flavors, they did not taste processed.  The most important thing- my kids loved them too!"
"Competitors",2022,"I got to try these through Influenster. Though I'd planned to buy my own, I'm glad I had to do it for the site, because otherwise I wouldn't have tried the Oatmeal Raisin. I'm not a fan of the combo. I don't know why.But,  did a great job. There was the perfect combination of oatmeal to raisin, and I didn't feel like I was tasting cardboard, as I tend to with oatmeal cookies. Instead, it was super moist, and honestly, if it had been hot, I would have assumed it was straight from the oven. Just perfectly done!"
"Competitors",2021,"These cookies are not only yummy but they are good for you. My children love them too. Its a great snack for them and I don't feel guilty giving it to them. Try one!!"
"Competitors",2021,"I do not like Oatmeal raisin cookies, but I have to say I was pleasantly surprised by the soft texture and the taste of these cookies. I would recommend these if you love oatmeal raisin cookies."
"Competitors",2021,"I was pleasantly surprised with this cookie. It has a great flavor and was nice and moist! My three year old daughter loved it also!"
"Competitors",2020,"This cookie was very good, but a little dry for my taste! I would also prefer it to taste more like a homemade cookie with more raisins."
"Competitors",2020,"Great taste and packaging. Perfect for lunch boxes and take along snacks. We have enjoyed these cookies and look forward to more flavors."
"Competitors",2020,"Generally, these  oatmeal cookies were a disappointment.  The major positive is that the first ingredient listed is whole grain oat flour.  Other pluses are that the cookie is not particularly sweet, individually wrapped, and it is soft, but not crumbly.  My husband and I tried these cookies for dessert last night.  The first issue was that they are 170 calories each, meaning we only had one, even though their size is not particularly large, around 3 inches in diameter.  Second, the overall taste and texture impression of the cookie is that it is commercially made; it will not remotely remind you of homemade.  Third, and personally, there are not enough raisins.  Finally, both of us noticed the cinnamon flavoring, which was border line too much; the ingredients list indicates allspice as well.  The only ""fortifications"" to the cookie are calcium (4%) and iron (8%)."
"Competitors",2022,"These cookies are alright, except that once you are finished you may notice an aftertaste and I think this is due to the cookies containing too much allspice.  The cookies also contain cinnamon, which does not leave an aftertaste."
"Competitors",2021,"The  Soft Baked Oatmeal Cookie was given to me to sample through Influenster Mom Vox box program.  It tasted like it was home baked.  I did notice it was a little heavy in the cinnamon department, so if you don't like cinnamon or if you have an allergy to it, then this would not be a good cookie for you.  This was shared with my 14 year old daughter that gave her seal of approval, too."
"Competitors",2021," Cookies for me is that one in the package is suffice for me with a cup of tea or hot cocoa. Usually I go digging for a few more cookies to conquer my sweet tooth but not this time."
"Competitors",2020,"This is a really good cookie! DIdnt really think that I would like a cookie from a company known for its oatmeal, but completely surprised!! It was soft and soooo chewy! Really good served warm & with a cold glass of milk!"
"Competitors",2020,"I tried this cookie (which came free in my Mom Vox Box 2012) and I fell in love with it! My kids and my husband liked it, too! It is soft and chewy with a delicious home-baked taste. We will definitely include this in our stash of healthy goodies & snacks!"
"Competitors",2021,"I wasn't sure if I was gonna like these until I received a free sample and fell in love with it. These cookies are so soft and yummy. My 5 year old loved it. Can't get enough of it."
"Competitors",2020,"I originally purchased these cookies at the store and then being an  I received a sample of the Oatmeal Raisin  Soft Baked Oatmeal Cookies. These make a great snack for kids and adults alike. These are great to carry in a diaper bag for that lil pick me up when out and about. They have so many flavors and styles of there new soft baked. They are soft but not crumbly, easy to eat not to chewy, they are filling and satsfying."
"Competitors",2020,"I'm not a fan of oatmeal or raisins (lol) but I wanted to taste the cookie before I gave it to my daughter. So I'll give my review based on how well she liked it. The cookie was extremely fresh when I opened it. My daughter ate about half of the cookie before putting the pack down. So I'll take that as she was somewhat satisfied because if she doesn't like it, she throws it aways and if she really likes it she'll eat it all! Ha! I am interested in finding out what other types of cookies are available because it is a more healthier alternative versus her eating chips or candy.**NOTE: In my review, I only took into account my thoughts on the cookie itself.  But if I had to grade this with the price that Amazon has it for, I would probably give it 1 star!  A 6-pack of these cookies is $2.69 so why is a 12-pack almost $35 on here?! Am I missing something, lol**"
"Competitors",2021,"These soft cookies are very tasty and have a great texture. They are just the right size for an afternoon snack."
"Competitors",2020,"I have only tried  Oatmeal raisin cookies and they were not my favorite, however Im still in love with their Oatmeal cereals and granola!"
"Competitors",2022,"Ok so I love oatmeal cookies they are amazing. And this is one that I approve on for its soft gooey and chewy. It is absolutely amazing. I love it, and would recommend it to anyone that loves oatmeal, and the raisins are sweet they do not taste tart and are not overpowering."
"Competitors",2020,"I love oatmeal raisin cookies, really love them.  So, I am always on the lookout for a good cookie...especially if they are made by someone other than me.  When I got the chance to sample  Soft Baked Oatmeal Cookies with Raisins, I said ""Why not?""  The cookies come 6 to a box and are individually wrapped.  They are pleasant soft oatmeal with a balanced blend of spices and raisins.  I would have liked more raisins.  They were also very soft almost, as another reviewer mentioned...powdery.  They did have a good taste and they are very convenient (good for lunches, tucked in a backpack or desk drawer) and I found them very filling/satisfying.  But, for me, they were just a bit off mark.  I guess I expected a soft oatmeal cookie to be a bit more solid and chewy.  I will buy them occasionally if I have a specific need for something quick and easy."
"Competitors",2022,"I was pleasently surprised about how soft this cookie was.  It had great flavor, I couldnt even tell there were raisins in the cookie, which is great because I dont normally like raisins.  I like that they come individually wrapped so that all the cookies don't dry out when you want to eat one.  Great snack to take on the go!"
"Competitors",2020,"Theses cookies are yummy and soft even with raisins my toddler likes them. My only problem is one cookie had 170 calories and is not remotely filling. It's not the healthiest snack but it sure is tasty!"
"Competitors",2020,"Love single served cookies and they are a perfect as a pick-me up. I don't cookies in the house, but this one can stay all wrapped and waiting for the perfect moment"
"Competitors",2022,"QUAKER SOFT BAKED OATMEAL COOKIES RAISINS is a product consisting of a box of six cookies.  Each of the six cookies is enclosed in a sturdy plastic envelope, with a tooth-edge at the top and bottom, suitable for grasping and for tearing open the envelope.  On the plus side, all of the cookies were intact, despite shipping.  The intact nature of the cookies was largely due to the fact that they are soft (not crunchy) and secondarily due to the secure packaging.  The cookies were bland and unadventuresome, both in taste and in texture.  Although the photographs on the cardboard box and on the plastic envelope show cookies having a surface dotted withabout 12 whole raisins, it was the case that the actual cookie contains a scattering of chopped raisin bits inside.  Therefore, the consumer should not expect to be treated to a cookies bearing a cargo of plump, juicy raisins.  In paying attention to the flavor, I noticed that the cookies had a detectable raisin flavor.  Also on the plus side, in knowing (from first-hand experience) that hard oatmeal can get wedged in between fillings, resulting in damage to teeth and fillings, the older consumer will be pleased that this QUAKER product is totally inocuous, as far as dental work is concerned.  These cookies are, indeed, sooooooft!Ordinary oatmeal has about 61 grams carbohydrate, 12 grams protein, and 7 grams fat, per 100 grams of oatmeal (Pomeranz (1987) Modern Cereal Science and Technology (pages 350-370)).  The NUTRITION FACTS label that this QUAKER product shows that the breakdown is as follows.  Each QUAKER cookie (42 grams) contains 27 grams carbohydrate, 6 grams of fat, and only 2 grams of protein.  Hence, it can be seen, that the cookies, as compared to straight oatmeal, is somewhat low in protein.  The low protein content should not be a concern to most adults, because growth, and the issue of acquiring the proper nutrient balance to sustain growth, is generally relevant only during pregnancy and lactation, and for growing children.  If any conclusion can be made regarding this fine product, is that it could be a preferred snack food for adults who have had multiple dental fillings, and need to worry about dental damage.  Although this cookie is fine for children, please remember that much better sources of protein are available, e.g., milk, cheese, meat, fish, poultry, tofu, and legumes (peas, beans, lentils)."
"Competitors",2022,"I love homemade oatmeal raisin cookies, the kind that are a little chewy, made with lots of oats, brown sugar, cinnamon, and not too many raisins.  So I was skeptical of this soft, ""store bought"" cookie.  I assumed it would be, well, bad.  I was pleasantly surprised.  It's made with whole grains, which imbues each cookie with 16% of daily fiber recommendations.  It was indeed soft, but it didn't seem artificially so, more like it was just cooled down from the oven.As I began my 'taste test', I appreciated the fact that the cookies are individually wrapped, which allows for easy transport in lunches or purses.  I took a small bite at first, because I was already prepared to be disappointed.  As that bite went down, I reached for another.  Then another.  Very tasty, as it turned out!  Soon the cookie was gone and I realized I wanted another one!  However, at 170 calories each, these are NOT ""low calorie"", they're just made with better ingredients than most.As for other nutrition information (other than the fiber and calorie count mentioned above), each cookie has 150 milligrams of sodium, so not too bad there.  You'll find 4% of calcium and 8% of iron (recommended daily requirements).The first ingredient is whole grain oat flour.  Sugar is about number 10 or so on the ingredient list.  One quibble I have is that the list of ingredients is rather lengthy.  My nutritionist has advised me to watch for products with what seem like extraordinarily long ingredient lists, probably means there's lots of stuff in there that's not exactly ""good"" for us, but it is what it is:  a factory-made, store-bought cookie that's got a pretty long list of ingredients and shelf life that don't come naturally to ""homemade cookies"".  Just accept it for what it is, a decent, convenient mass-produced cookie."
"Competitors",2022,"The folks at  really got the soft texture here, and the individual packages keep the cookies very soft and fresh.I would have liked more raisins, I couldn't hear ""it thru the grapevine"".Good nutrition for a cookie."
"Competitors",2021,"Taste: I thought these did a good job of mimicking the taste of home made cookies. Cinnamony and raisiny (though the raisins aren't big plump raisins...they're more suggestions of raisins...and they are sweetened by sugar and fructose NOT HFCS.Mouth feel: When Mom makes oatmeal cookies, you can feel the oat meal (usually) when you are chewing. This doesn't have that. The oats are milled to the point where the flavour is there but the texture is not. If this is a problem for you, you might want to pass. Other than that, it's probably a good idea to have a glass of milk handy. They are ""moist"" in that they aren't crunchy...but they verge on dry.Value: On Amazon, the cookies come to about .50$ a piece. Which is comparable to my local grocery.A good all around (large) cookie and I think I will try the other varieties...you should too!"
"Competitors",2020,"The box says, ""soft baked oatmeal cookies"" and that is exactly what you get!  The cookies are individually packed, which makes it easy to grab for lunches, or to throw in a purse or backback for ""on the go"" kids.  The cookies are fairly good sized, and packed with raisins.  I was concerned about an aftertaste that I have sometimes noticed with cookies that are pre-packaged (maybe a preservative that is often used?) but I did not notice any funny taste or smell to these cookies.  In fact, I could not find anything I was unhappy with!"
"Competitors",2022,"Oatmeal raisin cookies are my favorite.  Oats has done these well with this new product. The strongest flavor to come off is, perhaps surprisingly, cinnamon. It's a very strong taste at the tip of your tongue. The cookie also does have enough raisins for it to qualify as oatmeal raisin, which was something I was concerned about at first.The cookie is very soft and still tastes pretty fresh, even after all the packing and processing that obviously went into it. They're about as big as you'd imagine it to be from the picture on the box, which is actually impressive given how often cookies end up being smaller than they appear. Overall, this is a good choice if you want cheap, store-bought oatmeal cookies."
