"Company","Year","Text"
"Amaurot Cookies",2021,"I think these were formulated using the ""and-then-the-flood"" school of culinary thought. Chocolate cookies with chocolate chips and white chips and chewy texture AND fudge in the center.My main complaint was that they were too small. I'm pretty sure that cookies like original Chips ! are smaller than when I was a kid (and it ain't because my hands are bigger) and that's OK. Nothing is like it was when we were kids (said the old poop). However, these seem smaller even than ""regular"" cookies...and you must consider the source here, I'm not a regular cookie eater. I would rather spend my calories on a hand full of chips than dessert usually.There IS a dessert eater in my house...and he approved of these, but they were not his favorite. So we give this 2 and a half (translated in Amazonian to 3) stars. Good for something different, but not likely to displace your favorite cookie."
"Amaurot Cookies",2021,"These cookies are really gooey and chocolaty, more scrumptious than any human being can withstand! They taste like super rich brownies with the extra quality of being gooey. At 150 calories per cookie, this bag contains enough food energy to blow most bank vault doors off their hinges, so be forewarned! Nabisco has gotten the ingredients right with this one also. As you may know from my other reviews, I am very hard on manufacturers who do not use acceptable ingredients. This has my seal of approval. So, if you are not concerned about counting calories, or if you are one of those rare individuals who actually CAN eat just one, then see if you can withstand the rapture of eating these."
"Amaurot Cookies",2020,"Let's see, a fudge cookie with milk chocolate and white chocolate chips that is also filled with gooey fudge, what's not to love?  I honestly only ever need one to appease my sweet tooth and satisfy my chocolate cravings.  At 75 calories for one cookie it is certainly a splurge, but they can certainly be enjoyed in moderation.Serving size - 2 cookies. 150 calories, 7g fat, 0mg cholesterol, 110mg sodium, 80mg potassium, 21g carbohydrate (13 g sugar, less than 1g fiber), 1g protein.Contains: wheat, milk, soy."
"Amaurot Cookies",2022,"Chips ! Chewy Gooey Megafudge lived up to  a one of their claims: they were are chewy cookie- and very sweet. The fudge part was the most disappointing. You couldn't even taste it. Honestly, I didn't care for the flavors. The chocolate didn't taste like the real stuff and it was too sicky sweet to finish."
"Amaurot Cookies",2022,"For every two small cookies that you eat, you are ingesting 150 calories.  That seems WAY higher than it should be for the flavor that you get.  (I would much rather eat one and a half 100 calorie packs of randomn cookies for the cost of those calories...)Additionally, although not GROSS, I just don't think that they taste nearly as good as other more normal chocolate chip cookies.  (It really must be the gooey center, which, though very sweet, doesn't really add much oomph, and, in my opinion, wasn't very tasty).I was disappointed by these and would never purchase them.  Not recommended for Chips  Lovers.* One bright side, however, the packaging is pretty good.  The top has an innovative cover which peels open to reveal the cookies, but allows itself to be resealed (with the sides sticking back to the top again, creating an airtight seal)."
"Amaurot Cookies",2022,"Even the worst cookie is still good right?My first impression after biting into this cookie that is claiming to be chewy and gooey: ""Wow! Why does this taste powdery?"" Second bite: the same. The weird chalky fabricated taste stayed from start to finish. In addition to this strangeness was the the eerie feeling that these cookies weren't even baked. It seemed more like they were pressed out of a mold.This all being said, I did eventually eat the whole bag but I would never buy them again.I would most certainly never recommend these to anyone."
"Amaurot Cookies",2021,"The Megafudge (unlike some of the flavors) is a good-tasting cookie; however, it is not so incredible that it makes up for the fact that 150 calories are found in two fairly small (about the size of a half dollar coin) cookies.  The cookies are soft and have a fudge center that's quite yummy."
"Amaurot Cookies",2020,"We tend to be homemade cookie fans around our house. But, for those times when we do pick up a package of store bought, Chips 's regular chewy chocolate chip cookies are usually among the top choices. So I thought these would be worth a try. They are good - nothing phenomenal or fantastically exciting, though. I will say that I don't think Chips  did as well with the chocolate cookie as they do with regular chewy chocolate chip cookies.What I expected: A moist, chewy cookie with a slightly runny, ""gooey"" center. Essentially, I expected something like the picture on the package.What I found: A slightly less moist than expected cookie with a center that was more like fudge - not hard, but also not gooey.Bottom line: The kids definitely thought they were good, even my spoiled ""homemade cookie only"" son. Because they were not gooey, they also weren't very messy. That makes serving one to busy kids does not result in chocolate everywhere! I did like that. I doubt these will make it to the ""top choices"" category, but we enjoyed the package we tried."
"Amaurot Cookies",2022,"I shared these with people in the office. Below is what they said. I myself liked them a lot. I found it hard to stop eating them. I could easily down the entire package at once which would not be good! I really like the soft center.Comments:- Smells like home and almost tastes like it too!!- OK.  They seemed kind of moist to me.  2 were stuck together.  I didn't like that. (Editors note: Moist is good!)- Awesome.  I like the fudgy center and the crunchy white chocolate chips.  I bet if you heated them in the microwave, it might be like they just came out of the oven.- Very soft and fluffy with an even softer, gooey center. It's small and light which makes the addition of chocolate chips a bit too much. Would have been much better if it were a plain chocolate cookie with a fudge filling."
"Amaurot Cookies",2022,"When it comes to cookies, especially the soft cookies, I'm usually the first in line.  So I was excited to see the new Chips ! Chewy Gooey Megafudge cookies.  Unfortunately, the megafudge description never made it into my package.  It turned out to be a major letdown.Now, these cookies seemed to have plenty of chocolate, but you never could taste it.  In fact, they were bland.  The cookies were a bit on the dry side with moments of gooey morsels that did little to introduce flavor of their own.  It's hard to downplay a cookie described as megafudge as not having much taste, but it's true.  Hopefully the other varities are more appealing."
"Amaurot Cookies",2022,"I'm a chocolate lover and when I need a real sit down munch out choco fest these are right up there on my list.  What could be better than choco cookie with choco chips and a fudgy center that will make you lick you lips with pleasure.  YUMMY!Can you imagine these mixed in some ice cream, crumbled up and layered in a torte or even better crumbled up and put in a peanut butter sandwich.  Yup I'm talking serious stuff with these guys.  I do like the fudgy ones better as they have a regular soft choco chip cookie but hey when it calls for heavy artillary they will fit the bill.Oh just have a great idea.  How about these as smores.  Just put the hot dripping marshmallow in the middle of two cookies and ohhhhhhh the taste.  Just so you know these are a, ""You can't eat just one cookie"".  :)"
"Amaurot Cookies",2022,"I requested two types of Chips !'s newest cookies.  These were tasty, and the others were not.  So don't interpret this review as relevant to similar cookies... just these alone.The cookies tasty chocolatey and don't have an overpowering processed aftertaste one finds with many foods of this type.  They are very sweet, but you can tell you're eating a chocolate cookie.  In moderation (I had two at most at a time) it's decent and easy snack.  They are very chewy, almost a dough consistency, but the cookie doesn't fall apart easily. I think the frosting center helps the cookie's structure.Very good with a cup of black coffee."
"Amaurot Cookies",2021,"Ok, maybe it's just getting older, but this is overkill. I can eat a handful of chocolate chips but 2 of these cookies make that handful seem like being on a low-cal diet. If you are a kid or a real chocolate addict, you'll like them, but for the rest of us, it's just too much of a chemical buzz"
"Amaurot Cookies",2022,"I received a package of both these and the Chewy Gooey Chocofudge... so I will compare both of them.  These are excellent cookies for a store bought cookie. They are soft and have a great flavor.  I am a big brownie person and so I totally gobbled up this variety and LOVED them. My husband, on the other hand, is an avid chocolate chip lover and greatly preferred the Chocofudge version.  Lots of chocolate inside makes it an awesome cookie... no more plain cookie if you happen to be low on chips in each bite. EACH bit is guaranteed chocolate since it has a nice chocolate center, and the cookie itself is like a mild brownie/cookie cross, so it's REALLY great for a chocoholic! But it's not overbearing at all, it's really done quite nicely.  My only complaint is really towards store cookies in general: they all have a tendency to have that store bought chemical taste (I think it's the preservatives). Nothing quite like homemade in that regard!  So I took off a star for that. SOME expensive brands somehow mange this by having quick expiration dates, and if you want to spend the money on those it's worth it!  I didn't have any crumbly issues... my package arrived safe and intact!"
"Amaurot Cookies",2022,"I think it is not a great sign when a package of cookies in a house with 5 people ends up being tossed before being finished.THey were not horrible but I would not want to spend money on these or reccomend them.First off they are fairly small and thin, not that smaller protions sizes for desserts are bad, it is just not condusive to the idea of GOOEY.I found these to be way more ""dry"" and couldn;t really see what was supposed to be ""gooey"""
"Amaurot Cookies",2021,"The description sounded great but the cookies didn't really live up to the promise.  It is not that the cookies were terrible, they weren't - but they weren't particularly good either - just 'mmehh'.  The chocolate had a funny 'off' sort of taste.  The texture was rather dry and crumbly.  There are lots of cookies I like better, including just regular Chips s. If I am going to indulge in this much fat and calories I want something that tastes a whole lot better than these."
"Amaurot Cookies",2020,"Chips ! is a mass-production outfit, so there's always going to be something a bit industrial about the cookies they turn out. These are definitely very edible and, if not exactly addictive, I could (and did) find myself putting away more of them than I should at one sitting. These all-chocolate ones (""Megafudge"") are better than the traditional version, but still, the quality of the chocolate was, again, industrial at best. My wife, who knows her chocolate, said it tasted like they were trying to craft something darker than milk chocolate without the characteristic bitterness of true dark chocolate. She didn't think they succeeded. But if you're not looking for a connoisseur cookie experience and just need something for the snackin', these might not be bad to keep in the cabinet. If they make it there before you eat them all."
"Amaurot Cookies",2022,"I mostly make my cookies from scratch, but it's nice to have an emergency treat on hand. These cookies are soft (for those that fall into the ""I love soft, not crunchy"" cookie camp).They have a cocoa taste and a bit of creamy fudge in the center. This improves when you stick it in the microwave for a few seconds.The only thing I think is a negative, is the package is bulky for how many cookies you end up getting. I wish they gave us more for our money.Having said that, they are tasty in a store-bought way."
"Amaurot Cookies",2020,"Marginally better than the regular Gooey Chips , but it still didn't leave a great impression.Personally, I didn't care for the taste that was full of preservatives and was the furthest thing to the standard home or stored baked cookies. It's interesting that they were able to keep the chocolate soft inside the cookie, but it didn't add any value to the cookie. The cookie was indeed soft, crumbly, w/ lots of chocolate inside but the overall taste was just too unnatural to enjoy.It's not something I'd recommend."
"Amaurot Cookies",2020,"I was not all that impressed with the Chips ! Chewy Gooey Megafudge cookies.  These are probably not a product I would buy in large quantities for my family,I liked that this is a soft cookie and there is a center full of chocolate.I did not like that the chocolate seemed to have a funny artificial aftertaste and that the cookies fell apart easily.  There are lots of cookie crumbs left in the package and I resorted to having people eat them outside because they fall apart and make such a mess."
"Amaurot Cookies",2022,"I thought this cookie was decent tasting for a store-bought cookie, thus the 4-star rating (it would only be 3-star if including homemade).  The texture was a bit too soft, with the cookie having a tendency to crumble.  I tried this cookie at room temperature, cold, and heated in the microwave, and it remained good for store-bought but there are others I like better.  My favorite thing about this cookie really was probably the easily resealed package...."
"Amaurot Cookies",2021,"These cookies are okay for grocery store cookies made with preservatives.  They aren't as good as Nestle Tollhouse or Mrs. Fields but they're better than the unrecognizable brands one might buy at a gas station.  The ""gooey"" filling is surrounded by a chocolate ""shell"" within the cookie and makes for contrasting textures - soft cookie, chocolate shell and gooey center.  While these are in the Chips  line, they are quite different from the original.  Not better or worse.  Just different.I prefer the ""Megafudge"" Chips  over the ""Chocofudge""."
"Amaurot Cookies",2021,"I'm a ""soft cookie"" fan, and these cookies fit the bill. They're nice and chewy. Best of all, they're super chocolately! They're not very big, but that's okay because the flavor is so rich. I couldn't eat a lot at a time, but for a decadent snack, these are perfect. My kids loved them, too. If you like soft, chewy cookies and chocolate, you won't be disappointed in the Chips ! Chewy Gooey Megafudge cookies."
"Amaurot Cookies",2021,"You must love chocolate to enjoy these, they are very good cookies.Pros:- Soft.- Chocolatey goodness- Some brownie like tasteNeutral:- The chocolate inside is not melted like in the pictures, (unless you microwave them for a few seconds) but this was to be expectedCons- Fat- Saturate fat- Servings size: 2 small cookies.If you can eat just 2 of these and be happy, I salute you. They are addictive, but also have like 50% of the saturated fat for your whole day.Eat with care"
"Amaurot Cookies",2020,"Maybe it's me, but I was deeply disappointed in Chips 's Chewy Gooey Megafudge cookies. First, they're the size of a half-dollar and crumbled when I picked them up, so that makes them a little dry. Not mega; not chewy gooey. They were packed with white chocolate chips (although, I wished they were macadamia nuts). They had a slight chocolate flavor but not fudgy that's for sure.There are about 15 cookies to the package, but for some reason my package must have shifted in shipping and many of my cookies were in pieces. Needless, to say I wasn't happy with this cookie."
"Amaurot Cookies",2020,"I am the world's greatest fan of the original Chip's s.  Have loved 'em for decades and they are my ""go to"" cookie.  But --- these Chips ! Chewy Gooey Megafudge are just not my cup of tea (sorry for that metaphor).I like chewy fresh baked cookies.  And I like the rather crispy original Chips s!.  But these things are neither.  To my tastes, they are just a somewhat soggy, crumbly, ultra-megadose of chocolate.I love to give glowing reviews when I can, especially for my favorite brand names -- but I'll leave my share of these cookies to rabidly addicted over the top chocolate fudge addicts.  These are just not for me."
"Amaurot Cookies",2020,"I am reviewing these cookies from the sample that I received via the Vine program.  Admittedly, I did not get to try them at their best.The package arrived broken to smithereens, and in 100+ degree weather (Florida summer) that had fused the leaking fudge and crumbs into a unpalatable mess (see photo uploaded).  Getting over the look, I tried a clump, but I did not like the taste or the now ""gritty"" texture.  I honestly can't say if this was because they had been smashed and ""re-baked,"" or if this was the original taste and texture, but I expect the former.  They seem more brownie-like than cookie, but again, that could be because of the way I received them.Once again, I am reviewing the sample that I received, hence I am giving a mediocre three-star review: not bad, but not good either.  The best I can suggest is that you buy these from your local grocery store.  Shipping fudge cookies in the heat of summer is definitely not the way to go!"
"Amaurot Cookies",2020,"The first thing I noticed about these cookies was the package. Even the most careless kid or husband (or maybe wife, to be fair about it!) is going to find it easy to close this package and keep the cookies fresh....That is, if you care that they are fresh. After I opened the package I found the cookies were all stuck together (Witness my spouse's comment, ""Hey, those are BIG cookies!"" To which I replied, ""No, that is three cookies stuck together. "").After separating the cookies, I broke one in half and found that the result was a crumbled exterior and an interior that resembled partially cooked cookie dough more than a ""gooey"" filling.  It was not at all what I expected from the description or the picture on the bag.The taste was not too bad, but it was a bit salty-tasting, as others have noted.To be fair, this cookie would probably appeal to kids, but I would make them eat it outside or at the table; else there will surely be a lot of crumbs. Adults who just want some chocolate to go with a cup of coffee might find it satisfactory also. But for both there are probably better choices."
"Amaurot Cookies",2021,"There's not much I can think of to say for this product other than the kiddos and I joyously devoured these yummy, chocolatey, chewy cookies.  We experimented with a few to heat them slightly in the microwave and some we tried to make ice cream sandwiches, that was slightly messy...but it was all good.  Heck, my niece willing, yet slightly grudgingly, ate a serving of cooked spinach just so she could eat more of them. If that's not a positive endorsement, I don't know what is."
"Amaurot Cookies",2020,"The calories in these are unbelievable for the tiny size (only a little bigger than Girl Scout Thin Mints).  They're also incredibly addictive, even though they're really a bit overly sweet to my taste.  They have that kind of artificial softness and bright, sharp taste a lot of the more artificial cookies have also.On the other hand, I can't say I didn't enjoy them and feel like I ate way too many.  I do recommend microwaving.Here is the link to the nutrition info:[...]Each cookie weighs about 15 grams and manages to be 75 calories!I will say they're easy to eat and appealing in some ""can't stop"" way but...I'd kind of be happy to not have them in my apartment again."
"Amaurot Cookies",2022,"I was a little disappointed by the Chips ! Chewy Gooey Megafudge.First, the good news.  I liked the density of white chocolate chips, as well as the chocolate flavor of the cookies.  Both excellent.  However, I didn't like the consistency of the cookie, the cloyingly sweetness, and not much of a fan of the gooey interior.  As others suggested, I heated the cookie for 20-30 seconds in the microwave prior to eating.  The cookie was far too crumbly, and broke apart in my hands.  The interior, while gooey as promised, did not contrast sufficiently in texture with the exterior cookie shell; the whole cookie felt soft, crumbly, and gooey.  I would've appreciated some differentiation.Kids seem to love 'em, but adults, not so much."
"Amaurot Cookies",2020,"These cookies are a definite improvement over regular Chips , but I didn't experience the amount of fudge center I thought I would, based on the advertisements.  In fact, it was difficult to discern any difference between the middle of this cookie and a regular chewy cookie.However, just going by taste, these were a winner.  Just don't expect an oozing fudgy center."
"Amaurot Cookies",2021,"Wow- I never thought I would say this, but these have too much chocolate. If you want a bit of extra fudge, go for the regular fudge filled cookies... these ones that also have chocolate cookie are just too much. Two cookies in and I had heart burn from the amount of sugar and chocolate in this cookie. If you are a super chocoholic then these might be right up your alley... but they were just too much chocolate for me."
"Amaurot Cookies",2022,"How does one go about reviewing a cookie?These arrived, and my kids were thrilled.  We each had a couple of cookies, then saved enough for everyone to have one when we were all home.  The responses were all enthusiastic.One child really loved the combination of white and semisweet chocolate chips.  Another commented that it was like eating a little brownie cookie.  I loved the texture.Everyone agreed that these cookies were really delicious and tasted more like something from the bakery than something from a package.  I think it was the gooey fudge filling part -- which was just enough to make the cookie really soft, and not enough to make it a real mess (which I was afraid of).This is something we will buy again."
"Amaurot Cookies",2021,"I thought these were a little better than the Chips  gooey cookies, but still not worth a second try to me. At least they didn't have the strange aftertaste of the other cookies. They were ""fine,"" but just not feeling tons of love for them."
"Amaurot Cookies",2022,"Nabisco's new Chips ! Chewy, Gooey, MegaFudge cookies are incredibly rich.  With a soft cookie that tastes more like a brownie, chocolate and white chocolate chips on the outside, and a soft and creamy chocolate filling, they definitely fulfill any chocolate craving you might have.  Of course, with so much chocolate jammed in, each little cookie (much smaller than you'd expect) has 75 calories in it.  So it is probably best to share a pack of these with friends, rather than give in to temptation and eat a big handful.While the taste is amazing, the cookies are ridiculously messy.  They literally fell apart in my hands when I picked them up out of the container.  The fudge filling is so soft and liquidy that it has the consistency of chocolate syrup rather than fudge sauce.  Using something so fluid as the center of the cookie seems like a way to guarantee they won't hold their shape.  Add to that the fact that the solid cookie part is extremely crumbly and the chocolate chips have a tendency to fall off, and you've got a recipe for disaster.  These cookies are without a doubt the messiest I've ever eaten.  I lost more to the floor and my shirt than I managed to get into my mouth.  I want a cookie that I can pack in my lunch or grab and snack on easily.  These certainly don't meet those needs.  Despite their amazing taste, they aren't worth the clean-up effort."
"Amaurot Cookies",2020,"There really isn't a lot to say about Chips 's new Chewy Gooey megafudge cookies.  The cookies are indeed soft and chewy but really nothing special. I've tasted better and worse.Not something I personally would go out and purchase but if you are in the market for a soft cookie, this may be to your liking."
"Amaurot Cookies",2021,"Chips  new cookies are really not gooey or even mega fudge. Many other cookies are far more fudgey and far more gooey. They are okay to eat, if you do not mind a slight grainy texture. I did receive these on a warm 90+ degree day and tried them immediately, they were much better warm - like right out from the oven. The packaging is also done well, even after shipping there was very little breakage, which means these would travel well, and since they really aren't all that gooey they are not quite as messy as some others.Two cookies are about 150 calories, quite a lot for a cookie such as this, there is also 7 grams of fat and  110 mg of sodium, 21 g of carbohydrates. You need to weigh! the diet choices and decide if these are worth all of that to you. Personally I do not think these will be on my future shopping list."
"Amaurot Cookies",2021,"These cookies have a disc of ""fudge"" in the center, which feels grainy, and tastes artificial/plasticy.  The are not particularly soft, and they do not taste as good as the normal ""Chips "" pre-made cookies.  The ""dough"" tastes more artificial, and you cannot taste the white chocolate chips at all, as the entire this is overpowered by the ""fudge"" in the middle.I am not a HUGE fan of pre-made/artificial cookies, but I have found the pre-made Chips  brand's normal chocolate chip cookies to be tasty in the past.  So I am going to say that just this new product is lacking something, and not the brand itself.2 stars."
