"Company","Year","Text"
"Amaurot Cookies",2021,"Standard disclaimer:  Own Organics Ginger Snaps were obtained via the Amazon Vine program.Ok, my wife and I tried these ginger snaps and came to the same conclusion:  They're spicy and hard.The ginger is pronounced.  REALLY pronounced.  You have to eat this with a cup of tea or a glass of milk to cut the sharpness.  Another reason to have liquids on hand: these little suckers are HARD.  Serious crunch going on here.  However, a dunk in the aforementioned tea will soften them right up.I dig ginger snaps with a hot cup of tea, so you'd think these would be right up my alley.  BUT, the spice is a touch too harsh and the hardness of the cookie takes a serious dunk to get over.  Still, I can deal. Especially on a cold day.However, if you're looking for a snack cookie you can munch right out of the bag, these are NOT for you."
"Amaurot Cookies",2020,"This cookie offers the American version of gingerbread (i.e., the flavor of mixed spices and molasses including enough ginger to impart a mild bite) in a crunchy form.  It uses a mild-flavored molasses which does not overpower the spices.If you like gingerbread in a small, crunchy bite-sized format, you will love this cookie.  Personally I prefer  Own ginger oreos for crunchy ginger, and I would have liked this cookie to be in a soft-bake format."
"Amaurot Cookies",2020,"These cookies are crumbly in texture and small enough for one bite.  The taste is pretty spicy, so you should have a glass of milk at hand.  They are certainly different from other store bought ginger snaps, but I'm not sure they are any better.  I liked them, though."
"Amaurot Cookies",2020,"Yep, I did a blindfold taste test.  I got the  Ginger Snaps, placed them aside, and went to the store and bought Nabisco Ginger Snaps.  I did NOT open either package.  I had my wife open the packages.  She broke the cookies into bite size, handed them to me and I did 5 separate taste tests.  Of course, I had my glass of milk to complete the full test.  She mixed them up, different  brand in different order.  It would have been a better test if I could have gotten a third brand......could not find one.  The words that I used to describe Nabisco (as it turned out) Ginger Snaps were subtle, and  chewy.  The words that I used to describe  Ginger Snaps were more vibrant, more ginger taste, crunchier, and more ginger flavor.  Across the board....all 5 times.....I rated the  Ginger Snaps superior to the Nabisco brand.  I cannot compare against any other brand.  Seems I like the  Ginger Snaps.I have never actually done a taste test without kinda knowing the end result.  In this case, I swear that I never opened the boxes.  I had no idea what they looked like, so I really was doing this taste test thing for real.  I like Ginger Snaps....have not bought them for years......my kids don't really like them.  But they are all in college, so I can now buy things I want to eat.  I like Ginger Snaps.......with a tall glass of milk.I actually like both brands, but I give the  Ginger Snaps points for being more what I THINK a Ginger Snap should taste like.Hope this helps.  Good eats."
"Amaurot Cookies",2022,"I'll start with positive (always the best, right?).  My husband LOVES these cookies, seriously loves them.  I can tell you that I dislike them for the same reason he loves them so this cookie with be a love it or hate it kind of thing.  These are no kidding Ginger snaps.  No fake stuff here.  It is flavored with real ginger, to the point that there are even little bits of candied ginger in the cookies.  This is what my husband loves about them, the extra zip every time you bite into that bit of ginger and chew on it (it is big enough that you do chew on it).  I do not like that zip from the chunks of ginger, I couldn't finish the first cookie I ate out of the bag.  My husband happily finished off the entire bag in 2 days.Bottom line... if you love ginger and things that have a little bit of bite to it then you will love these ginger snaps.  They are worth trying and I absolutely LOVE the  brand.  (especially the marinara sauce.. just sayin')"
"Amaurot Cookies",2022,"These cookies really have some zip.  The ginger flavor is just right.  The cookies I sampled were burnt on the bottom and hard but so tasty I will give them another chance."
"Amaurot Cookies",2021,"These cookies are very good, but I'd only recommend them if you really love ginger snaps, because they go all out to be authentic. The ginger taste is very strong and the cookies are actually spicy, with a strong ginger aftertaste. They're also quite hard! If you like authentic ginger snaps, definitely give these a try. I'm not a huge fan of this type of cookie so for me they were just okay, but I can see how they'd be a huge hit with people who love ginger snaps. The ingredients are remarkably natural and not a huge list of unrecognizable chemicals. The bag is easily resealable, plus it's a generous size. Check these out if you like your ginger snaps very gingery and very snappy!"
"Amaurot Cookies",2021,"Crystallized ginger is eaten like candy in my house, so you can better believe I was thrilled to see these cookies.  The individual cookies are not overly large, which is a good thing since they are packed with real bits of crystallized ginger, giving them a slightly spicy zing.  If the cookies were bigger it might be too much.  They are crunchy, but not to the point that they crack and crumble everywhere.  I tried them with hot coffee as well as cold milk and they went well with both."
"Amaurot Cookies",2020,"First off, the flavor of these cookies is excellent. TheY really have that spicy fresh/candied ginger bite. Unfortunately, the overall texture and density of the cookie doesn't do justice to the flavor.The cookies are very hard and dense, much like peppernuts. But they're too big to get away with it like peppernuts do. So instead they just seem too hard and kind of stale.I did like that there wee lots of funny odd-shaped cookies, not all perfectly uniform factory specimens. I don't know whether mine weree flawed or this was by design, but I thought it charming.If you're going to crush these for a recipe, for instance, pumpkin pie crust, they would be outstanding. They're also great dunking cookies for tea and coffee--here the hardness really works. But on their own, they just come off as stale, dry cookies with a great ginger kick."
"Amaurot Cookies",2021,"The best ginger snaps are hard, crunchy, and gingery with a touch of heat and without cloying sweetness.   Own Organics Ginger Snaps succeed as far as I'm concerned.These cookies are small -- which I also like.  They go especially well with an afternoon cup of coffee.People who prefer big soft sweet cookies may not like these -- they are an authentic ginger snap.  I thought they were delicious as did the rest of the family -- and we will be purchasing these in the future."
"Amaurot Cookies",2022,"Thank you  for your  Own Organics Ginger Snaps, Family Recipe Cookies. My husband loves ginger snaps but hasn't found any in the states (he's Canadian) that he has liked. He loved these and said they were closest to the flavor of his Mother's cookies.Thanks again and I highly recommend these cookies."
"Amaurot Cookies",2022,"Well, these didn't last long around the house.  Nor did I get to sample all of them despite the fact that I, and not my wife and son, am the reviewer around here.  Suffice to say that these were a big hit. They've got a strong ginger bite to them, so you don't want ginger taste in your ginger snaps, these aren't the cookies for you. But if you like ginger, they're great.  They are very crunchy, so again, if you like soft, not the ones for you. But if you like snappy, they're great.  They aren't at all too sweet, which is often a complaint of mine with regard to cookies and snacks.  And did I mention they're very gingery? Linger in your mouth, flavor-pop gingery. the all-organic is an obvious plus.  The package comes with a bit of tape to help you reseal it once you've opened it. To be honest, it won't get much use--once you open it, they'll pretty much be gone.  Highly recommended."
"Amaurot Cookies",2022,"This review is for  Own Organics Ginger Snaps, Family Recipe Cookies.These ginger snaps taste good.  The cookies are about 1.25"" in diameter.  The right amount of ginger and the right amount of sweet.  Although some cookies are crunchy and slightly hard, and others are slightly more chewy possibly due to a larger percentage of molasses in individual cookies.  The bag has a resealable tape to seal the bag, yet it is not as effective as a zip lock, but it works. I prefer another brand of organic and natural ginger snaps over these cookies, but these are still quite good."
"Amaurot Cookies",2020,"These cookies have a decent texture and a very strong ginger taste, so they should be superb for anyone who really loves ginger."
"Amaurot Cookies",2022,"Let me start by stating that Ginger Snaps are my favorite cookie, so I went into this predisposed to liking the product. However, these little babies are mouth blissfulness! Just the right amount of sweet, with a great ginger burn to finish...Yum! The bag I received was very well done, so the cookies were perfectly crispy, with a soft center. Best Ginger Snap I have EVER had! These are going to be a staple in my house from here on out! And they are Dairy and Egg Free, so they are perfect for a multitude of folks who have allergies. Straight up win! So, so happy to have found this product!"
"Amaurot Cookies",2022,"On the plus side, both my son and I loved, loved, loved the taste of these. These really are snappy ginger snaps. But on the minus side, my mother was afraid to eat them, because they are so hard. She was afraid she'd break her veneers. So these cookies get a big thumbs up for taste, but a thumbs down too, because they are way harder then they ought to be."
"Amaurot Cookies",2021,"I have to admit, I love ginger snaps.  To be fair, I love anything ginger.  Ginger slices with sushi, pure ginger ale, gingerbread, even the mixed drink 'Dark & Stormy' which has rum and pure ginger brew in it.  I love the bite & spice of ginger, so use that knowledge as a precursor for this review :)I love  products as a whole because of the natural ingredients his company has always used, long before the recent fad of organic and 'going green' food products had come along.  These organic gingersnaps fit right in with his other food products in that the ingredient list is short, all natural, and delicious.  The cookies themselves are crunchy and have actual pieces of ginger in them.  And you can DEFINITELY taste the whole ginger.  There is serious bite to these cookies (which I personally love)  Myself and my boyfriend took out half a bag together with no problem over coffee on a Sunday morning (this was purely unintentional to have cookies for breakfast, but hey, these things happen)Being autumn, these perfectly compliment this cool time of year and are perfectly paired with coffee or hot cider.  I highly recommend them if you are a serious ginger foods lover!"
"Amaurot Cookies",2020,"It has the crunch of a ginger snap cookie, but the actual ginger taste was too overpowering--to the point where it kind of felt like it was burning my mouth. The ginger didn't hit me until after I chewed the cookie for a moment or so... and then WHAM!I had one cookie, and really did not want to have any others (even with my horrible sweet tooth).For those who love ginger snaps, I think you'll enjoy this. For the rest of you who aren't so crazy about them? I don't really think you'll like these."
"Amaurot Cookies",2022,"I love ginger cookies! The more ginger the better. These  Own Organic Ginger Snaps are awesome. Ginger snaps are hard to find at the store. I was quite excited to try these as the other  Own products that I have purchased have been great.If I made a ginger cookie at home..these would be what I wanted. Just ordered more from Amazon as I don't want to be without them. Thank you!"
"Amaurot Cookies",2022,"I had high hopes for this organic ginger snap and unfortunately, I was disappointed. I don't know if it's because it is organic or just because of the kind of ginger snap this is, but the ginger flavor is so strong that I couldn't finish my first cookie! They are just about too hard to even eat. If you love a strong taste of ginger and you like hard cookies, then you might like these, but otherwise, stay away."
"Amaurot Cookies",2022,"I love these cookies!  The ginger flavor is there, bursting in my mouth as soon as I take a bite, and the addition of the candied ginger to these snacks is quite good.  I think I'll buy some more of these when I get a chance!"
"Amaurot Cookies",2022,"I love these cookies! They are hard cookies and have a very strong ginger flavor, so much so that it is pretty spicy.  My kids hate them, they're absolutely not the type of ginger bread cookies that kids usually like (i.e., typical gingerbread men.)  These actually burn my mouth because they're so spicy. They are much more like old fashioned ginger snaps, as the name states.I've been a Newmans fan for many years, and like many of their products. These are great, and I actually ordered them expecting that nobody else in the house would like them. So, as planned, they've become my own private stash for a nice afternoon break with tea."
"Amaurot Cookies",2020,"I like this company and was predisposed to loving these cookies, but they were simply not gingery enough for me.The texture was excellent, but the flavor was bland."
"Amaurot Cookies",2022,"I loved these cookies.  I will have to put them high up in the cupboard to ration myself because I could easily eat the whole bag in one sitting.PROS:*Crispy, snappy texture*Strong ginger flavor*Over 70% of the ingredients are organic*Ingredients list is pretty basic--NO mysterious chemical names strung together for 10 lines*5 cookies for 130 calories -- decent bang for the caloric buck*2% Calcium and 1% Protein, which is pretty decent for a cookieCONS:*Strong ginger flavor may not appeal to all*May not meet the threshold for those that need a low-fat cookieSummary:  Great tasting cookie with crunch.  I'll be looking for these my next shopping trip."
"Amaurot Cookies",2022,"Gingersnap lovers (like me), will be delighted with these organic, bite-sized cookies which are packed with the flavorful zing of fresh ginger.Each little cookie (about half-dollar size) is a crunchy (VERY crunchy) mouthful of sweet candied ginger, molasses, with a hint of peppery fresh ginger. About as authentic as gingersnap taste gets, unless the cookie is homemade!Serving size is 5 cookies (at 130 calories), and even though the cookies are small, 5 are plenty per serving, since the flavor is so intense.My family loved them, and I'll certainly buy them in the future!"
"Amaurot Cookies",2020,"I was glad to see a new product in the  Own line, and hooray, hooray, this one is vegan.  I love  Ginger O's, so I wanted to try the ginger snaps.The little foil bag is filled with cookies that are about the size of a quarter, which you think would make it easy to overindulge, but each bite-size cookie packs a gingery zip, so definitely best not to overindulge.  It's made with candied ginger and powdered ginger, along with molasses, an absolute must in any ginger cookie (at least in my opinion).  I found them very tasty and crunchy (maybe because it's hard to reseal the bag properly) and I definitely recommend them to anyone who loves a real ginger cookie."
"Amaurot Cookies",2022,"I love the taste and smell of ginger, and I really love ginger snaps. These ginger snaps definitely have some real bite to them and a good kick of ginger. You can actually see the crystallized ginger pieces in the cookies. I don't do the whole organic thing, so these are a bit pricey, but they are good."
"Amaurot Cookies",2022,"I confess I do not like ginger, I got these for my husband who like gingery gingersnaps, and well... he loved them! Crunchy, fresh-tasting, and spicy! Enjoy a nice cookie break with these!"
"Amaurot Cookies",2021,"I've been a baker since childhood.  The first cookie I ever made was the Tollhouse chocolate chip cookie.  I've also made ginger snaps before and while mine are considerably larger than these quarter-size snaps the taste is similar.  Full-bodied spices, sweet, but not too sweet, and crisp.  In other words, these cookies pass the 'homemade' taste test.  The ones I received were also a little burnt on the bottom, which I kind of like.  To each his/her own.  So, I like my ginger snaps a little burnt on the bottom.  Don't judge me! :o)"
"Amaurot Cookies",2020,"I really like these ginger snap cookies, but they may not be for everyone. They have a strong ginger flavor, however a little light on any cinnamon/nutmeg flavor. They are thicker than the gingersnaps I ate as a kid, but I personally like the meatier, thicker cookie because it gives the cookie a strong crispy, crunch that goes extremely well with my morning hot tea or coffee."
"Amaurot Cookies",2022,"These cookies are very crispy with a very strong, fresh ginger taste.  Some may think the ginger is overly strong but I love ginger so I really enjoyed them.  The ginger has an aromatic flavor like that of fresh ginger.  Very good ginger snaps."
"Amaurot Cookies",2022,"I received this package from the Amazon Vine program.  I ordered it because I've always loved gingersnaps, and I've felt that Paul Newman baked good products are generally a step or two above the rest of the offerings on the baked goods' shelf.  The bag of cookies was small, but packed full of flavor.  I love gingersnaps which have candied ginger in them.  The little bits of ginger kind of stick to my teeth and they leave a deliciously peppery bite after I've swallowed the cookie.  It's hard to find potent gingersnaps, and Paul Newman seems to have answered my desire for flavor.  However, these cookies are dangerously hard for my teeth.  On a scale of 1-10, with 1 being soft like a Lofthouse iced cookie and 10 being harder than a pretzel rod, this cookie is probably an 11 or 12.  In order to bite into one of the cookies, I had to line the cookie up with an incisor tooth and crunch down hard on it. Having just broken out a filling in a molar by biting down on a large mint Life-Saver, I am more careful with the texture of things I am eating. I learned to eat these gingersnaps after dunking each cookie in a cup of hot coffee for a second.  The actual cookies appeared to be burned on the bottom, but there was no burned flavor from the very dark color. I would recommend this cookie to people with strong teeth, but not for people who wear braces, have crowns or bridges, or weakened tooth enamel."
"Amaurot Cookies",2021," Own Organics Ginger Snaps, are crisp rounds with candied bits of ginger that have some kick. Addictive chews that keep you going back for more. My wife likes them a lot, very spicy--probably the spiciest cookies she has tasted."
"Amaurot Cookies",2020,"My family and I love gingersnaps, so we were excited to get to review this new cookie made by the Paul Newman company  Own.  Overall it is an excellent cookie, a snack for cool, crisp fall days spent outdoors on a rocking chair or a porch swing.This cookie is organic, made with organic flour and organic sugar.  The ginger taste is powerful, and candied ginger is used (instead of powdered) for the key ginger ingredient.I used this cookie as a snack in my children's lunch boxes for school, and as a snack for my husband at work.  I ate them at home with regular coffee, which in my opinion emphasized the strong ginger flavor.In summary:  Own organic gingersnap cookie is a very good, somewhat healthy cookie that will appeal to people who enjoy organic products"
"Amaurot Cookies",2020,"These cookies delivered a smooth ginger flavor without the peppery aftertaste.  They are small cookies, and it would be easy to eat through a package in one sitting.  I enjoyed them with tea, but the flavor would go well with milk or coffee as well.  I would recommend these for the cookie lover."
"Amaurot Cookies",2020,"These cookies are small, hard and very crunchy.  Nice ginger flavor with pleasant ""afterburn"" in the back of the throat.  I like the texture but I'm not too fond of the small bits of candied ginger that are mixed into the cookies - they have a toffe-like consistency and they tend to get stuck in my teeth.  Other than that, these cookies are good, and it always feels nice to enjoy a snack made with natural ingredients.  The only way these could be better is if I made them myself (without ginger chunks in 'em.)"
"Amaurot Cookies",2021,"I like ginger snaps, but these are *GINGER* snaps, definite stress on the ginger. The cookies contain both candied and powdered ginger, but no cinnamon or nutmeg - it they do, then they fall into the category of ""spices,"" which is found at the end of the list of ingredients.The cookies themselves are quite interesting, very gingery and crisp. Children will probably find them a bit overwhelming, but adults will find their taste interesting. I find they go well with coffee or tea, or a nice flavorful schnapps.(Review of  Own Organics Ginger Snaps, Family Recipe Cookies)"
"Amaurot Cookies",2020,"This is a little hard to bite ginger snap, but if you dip it in milk or coffee then you may get to enjoy this stuff. The manufacturer claims that this is a Vegan cookie with no artificial flavor or no trans-fatty acids, but I think this is a product of Mother Nature. On the positive side, ginger is known to decrease pain from arthritis. It may also have cholesterol lowering properties. Preliminary research also indicates that ginger may have positive effect on anxiety.Actor Paul Newman founded this line of food products,  Own, and he established a policy that all proceeds, after taxes, would be donated to charity. One beneficiary of his philanthropy is the Hole in the Wall Gang Camp, a residential summer camp for seriously ill children, which is located in Ashford, Connecticut.1. <a href=""http://www.amazon.com/gp/product/B000EPP588"">Mi-Del, Swedish Style Ginger Snaps, 10-Ounce Bags (Pack of 12)</a>2. <a href=""http://www.amazon.com/gp/product/B004XUGGLA"">Annie's Homegrown Ginger Snap Gluten Free Cookies, 6.75-Ounce (Pack of 4)</a>3. <a href=""http://www.amazon.com/gp/product/B004XUGGLA"">Annie's Homegrown Ginger Snap Gluten Free Cookies, 6.75-Ounce (Pack of 4)</a>"
"Amaurot Cookies",2022," Own Organics Ginger Snaps are delicious. They have an awesome ginger flavor. Also, some cookies are crunchy and some chewy. This is a great all natural organic cookie too. It's so difficult to find tasty ginger snaps these days. For 6 bags at $2.50 a bag, a great product at a great price. I highly recommend these cookies."
"Amaurot Cookies",2021,"These cookies are small, (about 1 inch wide, very very crisp, and very very ""gingery.""  Of all the brands of ginger snaps I've tried, these are the best.  The taste is real, the texture is hard and crispy, and I could eat the whole package if I tried."
"Amaurot Cookies",2022,"I adore ginger snaps, and I think that most all of  Own products are excellent.  The company uses top quality ingredients, nothing artificial, and they donate most (all?) of the profits to various charities.That said, these are excellent cookies IF you love your ginger snaps really (and I mean REALLY) gingery.  These ginger snaps snap back.  I like my ginger snaps just a little sweeter.  But I have to admit that once I got used to the heat that these cookies generated on my tongue, I finished the entire bag in a couple of days.  I liked them best with a glass of milk to take away some of the sting of the ginger -- even dunking helped.  I think these would make a really interesting crust for a vanilla cream pie, also.I will be purchasing them again.  But these are probably not cookies for children, unless they have sophisticated palates."
"Amaurot Cookies",2022,"I've long been a fan of  Own Organics, and these cookies did not disappoint. In a word, they are delicious. They have just enough sweetness and are a perfect snack. These are also suitable for vegans. One caution: there is a fair amount of sugar per serving. Granted, the sugar is organic cane sugar, but it is still sugar nonetheless. While these aren't health food, they certainly are better than some of the other cookies on the market and fine for an occasional treat."
"Amaurot Cookies",2022,"In my mind there are two types of ginger snaps...soft and chewy and hard and crunchy.  Just so you are aware, these are the crunchy kind.Like most gingersnaps they're fairly low in calories.  Each cookie is about the diameter of a half dollar and based on the nutrition info (5 cookies = 1 serving = 130 cal) they're about 25 calories each.Gingersnaps also range in the flavors...this one has the molasses defined and some complex spice flavors...ginger is fairly predominate though...a little harsh, but if you like that good enough.Pretty good all in all.  Nothing special - don't know if I'll buy them in the future, but I'm enjoying munching them and when I'm in a gingersnap mood these would certainly fulfill the craving so good enough!"
"Amaurot Cookies",2022,"These are a bit different than your average variety ginger snap.  With actual bits of chewy, candied ginger and strong spice that's zingy with a hint of a bitter aftertaste.  Not unpleasant to me, but I can see where some might not like it.  Personally, I find the complex, strong flavors interesting and tasty.  I like 'em.The cookies are very crisp (hard) so they'll definitely snap!  Great for dipping in hot tea or with ice cream."
